{
 "schema": "pii-candidate-comparison-receipt/1",
 "supportClaims": false,
 "authorityChanged": false,
 "ownerAcceptance": null,
 "planDigest": "39ad1d86b862e70e79ccb9f94e684e5e6bfe7507e774a861c98f602f33121693",
 "mode": "official",
 "engine": {
  "commit": "b1c097e40bad456e52f904f626cca00b69c45612",
  "binarySha256": "24ccae246f23e9f9fe3f847971fac3462be7b3898e0c52ccf488ac09252ac053",
  "shimSha256": "21664407345b099d3f5e44db26bcfb037b2e981635dec0a7b5383b42b737e0a8",
  "canonical": true,
  "platform": "linux-x64"
 },
 "activation": {
  "baseline": {
   "state": "available",
   "scope": "installed-product-configuration-only",
   "supportClaims": false,
   "surfaces": [
    {
     "surface": "node-addon",
     "checks": [
      {
       "requestedSelectors": [],
       "artifact": "addon",
       "activationIdentity": "credentials=full;selectors=off;families=;vocabulary=pii-context/v2"
      },
      {
       "requestedSelectors": [
        "pii:global"
       ],
       "artifact": "addon",
       "activationIdentity": "credentials=full;selectors=pii:global;families=pii:global:email,pii:global:iban,pii:global:network-address,pii:global:payment-card,pii:global:phone;vocabulary=pii-context/v2"
      },
      {
       "requestedSelectors": [
        "pii:us"
       ],
       "artifact": "addon",
       "activationIdentity": "credentials=full;selectors=pii:us;families=pii:global:email,pii:global:iban,pii:global:network-address,pii:global:payment-card,pii:global:phone,pii:us:ssn;vocabulary=pii-context/v2"
      },
      {
       "requestedSelectors": [
        "pii:global",
        "pii:us"
       ],
       "artifact": "addon",
       "activationIdentity": "credentials=full;selectors=pii:global,pii:us;families=pii:global:email,pii:global:iban,pii:global:network-address,pii:global:payment-card,pii:global:phone,pii:us:ssn;vocabulary=pii-context/v2"
      },
      {
       "requestedSelectors": [
        "pii:family:global:email"
       ],
       "artifact": "addon",
       "activationIdentity": "credentials=full;selectors=pii:family:global:email;families=pii:global:email;vocabulary=pii-context/v2"
      },
      {
       "requestedSelectors": [
        "pii:family:global:iban"
       ],
       "artifact": "addon",
       "activationIdentity": "credentials=full;selectors=pii:family:global:iban;families=pii:global:iban;vocabulary=pii-context/v2"
      },
      {
       "requestedSelectors": [
        "pii:family:global:network-address"
       ],
       "artifact": "addon",
       "activationIdentity": "credentials=full;selectors=pii:family:global:network-address;families=pii:global:network-address;vocabulary=pii-context/v2"
      },
      {
       "requestedSelectors": [
        "pii:family:global:payment-card"
       ],
       "artifact": "addon",
       "activationIdentity": "credentials=full;selectors=pii:family:global:payment-card;families=pii:global:payment-card;vocabulary=pii-context/v2"
      },
      {
       "requestedSelectors": [
        "pii:family:global:phone"
       ],
       "artifact": "addon",
       "activationIdentity": "credentials=full;selectors=pii:family:global:phone;families=pii:global:phone;vocabulary=pii-context/v2"
      },
      {
       "requestedSelectors": [
        "pii:family:us:ssn"
       ],
       "artifact": "addon",
       "activationIdentity": "credentials=full;selectors=pii:family:us:ssn;families=pii:us:ssn;vocabulary=pii-context/v2"
      }
     ]
    },
    {
     "surface": "node-forced-wasm",
     "checks": [
      {
       "requestedSelectors": [],
       "artifact": "wasm",
       "activationIdentity": "credentials=full;selectors=off;families=;vocabulary=pii-context/v2"
      },
      {
       "requestedSelectors": [
        "pii:global"
       ],
       "artifact": "wasm",
       "activationIdentity": "credentials=full;selectors=pii:global;families=pii:global:email,pii:global:iban,pii:global:network-address,pii:global:payment-card,pii:global:phone;vocabulary=pii-context/v2"
      },
      {
       "requestedSelectors": [
        "pii:us"
       ],
       "artifact": "wasm",
       "activationIdentity": "credentials=full;selectors=pii:us;families=pii:global:email,pii:global:iban,pii:global:network-address,pii:global:payment-card,pii:global:phone,pii:us:ssn;vocabulary=pii-context/v2"
      },
      {
       "requestedSelectors": [
        "pii:global",
        "pii:us"
       ],
       "artifact": "wasm",
       "activationIdentity": "credentials=full;selectors=pii:global,pii:us;families=pii:global:email,pii:global:iban,pii:global:network-address,pii:global:payment-card,pii:global:phone,pii:us:ssn;vocabulary=pii-context/v2"
      },
      {
       "requestedSelectors": [
        "pii:family:global:email"
       ],
       "artifact": "wasm",
       "activationIdentity": "credentials=full;selectors=pii:family:global:email;families=pii:global:email;vocabulary=pii-context/v2"
      },
      {
       "requestedSelectors": [
        "pii:family:global:iban"
       ],
       "artifact": "wasm",
       "activationIdentity": "credentials=full;selectors=pii:family:global:iban;families=pii:global:iban;vocabulary=pii-context/v2"
      },
      {
       "requestedSelectors": [
        "pii:family:global:network-address"
       ],
       "artifact": "wasm",
       "activationIdentity": "credentials=full;selectors=pii:family:global:network-address;families=pii:global:network-address;vocabulary=pii-context/v2"
      },
      {
       "requestedSelectors": [
        "pii:family:global:payment-card"
       ],
       "artifact": "wasm",
       "activationIdentity": "credentials=full;selectors=pii:family:global:payment-card;families=pii:global:payment-card;vocabulary=pii-context/v2"
      },
      {
       "requestedSelectors": [
        "pii:family:global:phone"
       ],
       "artifact": "wasm",
       "activationIdentity": "credentials=full;selectors=pii:family:global:phone;families=pii:global:phone;vocabulary=pii-context/v2"
      },
      {
       "requestedSelectors": [
        "pii:family:us:ssn"
       ],
       "artifact": "wasm",
       "activationIdentity": "credentials=full;selectors=pii:family:us:ssn;families=pii:us:ssn;vocabulary=pii-context/v2"
      }
     ]
    }
   ]
  },
  "candidate": {
   "state": "available",
   "scope": "installed-product-configuration-only",
   "supportClaims": false,
   "surfaces": [
    {
     "surface": "node-addon",
     "checks": [
      {
       "requestedSelectors": [],
       "artifact": "addon",
       "activationIdentity": "credentials=full;selectors=off;families=;vocabulary=pii-context/v2"
      },
      {
       "requestedSelectors": [
        "pii:global"
       ],
       "artifact": "addon",
       "activationIdentity": "credentials=full;selectors=pii:global;families=pii:global:email,pii:global:iban,pii:global:network-address,pii:global:payment-card,pii:global:phone;vocabulary=pii-context/v2"
      },
      {
       "requestedSelectors": [
        "pii:us"
       ],
       "artifact": "addon",
       "activationIdentity": "credentials=full;selectors=pii:us;families=pii:global:email,pii:global:iban,pii:global:network-address,pii:global:payment-card,pii:global:phone,pii:us:ssn;vocabulary=pii-context/v2"
      },
      {
       "requestedSelectors": [
        "pii:global",
        "pii:us"
       ],
       "artifact": "addon",
       "activationIdentity": "credentials=full;selectors=pii:global,pii:us;families=pii:global:email,pii:global:iban,pii:global:network-address,pii:global:payment-card,pii:global:phone,pii:us:ssn;vocabulary=pii-context/v2"
      },
      {
       "requestedSelectors": [
        "pii:family:global:email"
       ],
       "artifact": "addon",
       "activationIdentity": "credentials=full;selectors=pii:family:global:email;families=pii:global:email;vocabulary=pii-context/v2"
      },
      {
       "requestedSelectors": [
        "pii:family:global:iban"
       ],
       "artifact": "addon",
       "activationIdentity": "credentials=full;selectors=pii:family:global:iban;families=pii:global:iban;vocabulary=pii-context/v2"
      },
      {
       "requestedSelectors": [
        "pii:family:global:network-address"
       ],
       "artifact": "addon",
       "activationIdentity": "credentials=full;selectors=pii:family:global:network-address;families=pii:global:network-address;vocabulary=pii-context/v2"
      },
      {
       "requestedSelectors": [
        "pii:family:global:payment-card"
       ],
       "artifact": "addon",
       "activationIdentity": "credentials=full;selectors=pii:family:global:payment-card;families=pii:global:payment-card;vocabulary=pii-context/v2"
      },
      {
       "requestedSelectors": [
        "pii:family:global:phone"
       ],
       "artifact": "addon",
       "activationIdentity": "credentials=full;selectors=pii:family:global:phone;families=pii:global:phone;vocabulary=pii-context/v2"
      },
      {
       "requestedSelectors": [
        "pii:family:us:ssn"
       ],
       "artifact": "addon",
       "activationIdentity": "credentials=full;selectors=pii:family:us:ssn;families=pii:us:ssn;vocabulary=pii-context/v2"
      }
     ]
    },
    {
     "surface": "node-forced-wasm",
     "checks": [
      {
       "requestedSelectors": [],
       "artifact": "wasm",
       "activationIdentity": "credentials=full;selectors=off;families=;vocabulary=pii-context/v2"
      },
      {
       "requestedSelectors": [
        "pii:global"
       ],
       "artifact": "wasm",
       "activationIdentity": "credentials=full;selectors=pii:global;families=pii:global:email,pii:global:iban,pii:global:network-address,pii:global:payment-card,pii:global:phone;vocabulary=pii-context/v2"
      },
      {
       "requestedSelectors": [
        "pii:us"
       ],
       "artifact": "wasm",
       "activationIdentity": "credentials=full;selectors=pii:us;families=pii:global:email,pii:global:iban,pii:global:network-address,pii:global:payment-card,pii:global:phone,pii:us:ssn;vocabulary=pii-context/v2"
      },